{
  "$schema": "./case.schema.json",
  "id": "case01",
  "level": 1,
  "title": "臨床推論課題　症例1",
  "subtitle": "AudioScope EDU 連動課題／レベル1",
  "diagnosis": "両側滲出性中耳炎",
  "target": "言語聴覚療法学科・聴覚検査領域",
  "duration": "20〜25分（照合・振り返りを含む）",
  "examinations": "ティンパノメトリー・アブミ骨筋反射検査・DPOAE・純音聴力検査",
  "objective": "4検査の結果を相互に突き合わせ病巣を推定する／マスキング量を計算できる",
  "generation": {
    "profile": "CHL_OME",
    "ageGroup": "30s",
    "sex": "female",
    "severity": 2,
    "ears": "both",
    "seed": 4101,
    "_comment": "severity≥2 で Tym B・ART 消失・DPOAE refer（教材シート所見と一致）。学生シートと EDU 出力は必ずこの値から派生する。seed は授業回ごとに固定すること。"
  },
  "masking": {
    "interauralAttenuationAC": 50,
    "interauralAttenuationBC": 0,
    "safetyMargin": 10,
    "occlusionCorrection": false,
    "frequencies": [
      500,
      1000,
      2000
    ],
    "testEar": "right",
    "nonTestEar": "left"
  },
  "representativeThresholds": {
    "_comment": "教員用の代表値。build/sync-thresholds.mjs で EDU の生成結果から更新できる。seed を変えたら必ず再同期すること。",
    "source": "generator",
    "generatedAt": "2026-09-23T20:01:14.932Z",
    "generatorOpts": {
      "profile": "CHL_OME",
      "ageGroup": "30s",
      "sex": "Female",
      "severity": 2,
      "seed": 4101
    },
    "ac": {
      "right": {
        "125": 15,
        "250": 25,
        "500": 30,
        "1000": 20,
        "2000": 15,
        "4000": 5,
        "8000": 0
      },
      "left": {
        "125": 10,
        "250": 30,
        "500": 30,
        "1000": 25,
        "2000": 15,
        "4000": 0,
        "8000": 0
      }
    },
    "bc": {
      "right": {
        "250": 5,
        "500": 15,
        "1000": 0,
        "2000": 0,
        "4000": -5
      },
      "left": {
        "250": 15,
        "500": 15,
        "1000": 10,
        "2000": 0,
        "4000": 0
      }
    }
  },
  "history": [
    "32歳・女性。2週間前に発熱と鼻閉を伴う感冒があり、その後から両耳の閉塞感が続いている。自分の声が響いて聞こえる。テレビの音量を以前より上げるようになった。",
    "耳痛・耳鳴・めまいはない。騒音職場歴なし、耳疾患の既往なし、聴力検査は健診以外で受けたことがない。"
  ],
  "findings": {
    "tympanometry": {
      "rows": [
        [
          "型",
          "B型",
          "B型"
        ],
        [
          "ピーク圧",
          "同定不能",
          "同定不能"
        ],
        [
          "静的コンプライアンス",
          "同定不能",
          "同定不能"
        ],
        [
          "外耳道容積",
          "正常範囲",
          "正常範囲"
        ]
      ]
    },
    "acousticReflex": {
      "rows": [
        [
          "非交叉",
          "消失",
          "消失"
        ],
        [
          "交叉",
          "消失",
          "消失"
        ]
      ]
    },
    "dpoae": {
      "criterionSNR": 6,
      "frequencies": [
        "1k",
        "2k",
        "3k",
        "4k",
        "6k",
        "8k"
      ],
      "snr": {
        "right": [
          0.2,
          0.1,
          0.9,
          0.8,
          0.8,
          -0.1
        ],
        "left": [
          0.3,
          0,
          0.9,
          0.8,
          0.8,
          0
        ]
      }
    }
  },
  "teaching": {
    "coreMessage": "DPOAE 無反応は蝸牛障害を意味しない。",
    "rationale": [
      "中耳伝達に障害があると、刺激音が蝸牛に届く段階と、歪成分が外耳道に戻る段階の両方で減衰する。結果として蝸牛が正常でも DP は検出できない。つまりこの症例の DPOAE は「蝸牛が悪い」ではなく「蝸牛を評価できていない」が正解となる。",
      "学生は「反応なし＝障害あり」と機械的に対応づけがちで、ここが最大の誤答源になる。だからレベル1の1題目に置いている。"
    ],
    "orderRationale": {
      "title": "検査順序について（DPOAE を純音聴力検査より前に置く理由）",
      "paragraphs": [
        "本課題では DPOAE（S3）を純音聴力検査（S4）より前に提示している。純音聴力検査を先にすると、学生は骨導が正常であることを知った状態で DPOAE を解釈するため、「骨導が正常だから蝸牛は無事」という答えが先にある確認作業になってしまう。",
        "順序を逆にすると、骨導を知らないまま DPOAE 無反応を解釈させられる。ここで「蝸牛障害だ」と飛びつくか、「今は判断できない」と踏みとどまれるかが分かれる。そのうえで S4 で骨導正常を見て自分の判断を修正する（あるいは保留が正しかったと確認する）。信念の修正が実際に起こるため、学習として別物になる。S3 の Q3-4 がこの橋渡しにあたる。"
      ]
    },
    "secondaryAims": "B型ティンパノグラムで外耳道容積を確認する習慣づけ。骨導マスキングは検耳の骨導＋安全域を非検耳に負荷する。",
    "expectedOutput": "想定される出力は、気導 15〜25 dB HL 程度、骨導 0〜5 dB HL 程度、ABG は 15〜20 dB を中心とする軽度伝音難聴。生成器の検証結果では滲出性中耳炎の ABG は中央値 15.0 dB（四分位範囲 10.0〜20.0）であった。",
    "seedWarning": "学生間で議論させる場合は乱数初期値を固定すること。可変にすると細部の閾値が変わり、答え合わせが噛み合わない。マスキング計算の正答も変わる。"
  },
  "stages": [
    {
      "id": "S1",
      "title": "病歴",
      "showHistory": true,
      "questions": [
        {
          "id": "Q1-1",
          "prompt": "この時点で考えられる病態を、可能性の高い順に3つ挙げてください。",
          "space": {
            "type": "lines",
            "count": 3
          },
          "answer": [
            "感冒後の両耳閉塞感・自声強聴という組み合わせから、滲出性中耳炎が第一候補。次に耳管機能障害（滲出液貯留に至る前段階）、両側の耳垢塞栓。自声強聴は耳管開放症でも生じるが、開放症では臥位で改善する特徴があり、また感冒後の経過とは合いにくい点を指摘できれば加点。"
          ]
        },
        {
          "id": "Q1-2",
          "prompt": "どの検査を、どの順で実施しますか。順序の理由も書いてください。",
          "space": {
            "type": "fillTable",
            "widths": [
              700,
              2600,
              5720
            ],
            "header": [
              "順",
              "検査",
              "この順にする理由"
            ],
            "rows": [
              [
                "1",
                "",
                ""
              ],
              [
                "2",
                "",
                ""
              ],
              [
                "3",
                "",
                ""
              ],
              [
                "4",
                "",
                ""
              ]
            ],
            "rowHeight": 520
          },
          "answer": [
            "順序は「侵襲が低く、後続の検査の解釈に必要な情報を先に得るもの」から組む。耳鏡・鼓膜所見の確認 → ティンパノメトリー → アブミ骨筋反射 → DPOAE → 純音聴力検査。ティンパノを先に置く理由を言語化できているかを見る。中耳の状態が分かっていれば気骨導関係を予測でき、マスキングの計画も立てやすい。"
          ]
        }
      ]
    },
    {
      "id": "S2",
      "title": "ティンパノメトリー・アブミ骨筋反射検査",
      "showTympanometry": true,
      "showAcousticReflex": true,
      "questions": [
        {
          "id": "Q2-1",
          "prompt": "ティンパノグラムがB型のとき、外耳道容積の値を必ず確認する理由を説明してください。",
          "space": {
            "type": "lines",
            "count": 2
          },
          "answer": [
            "B型は「ピークが同定できない」だけの所見なので、それ自体では原因を特定できない。外耳道容積を併せて見ると切り分けられる。容積が正常なら中耳液貯留、著明に大きければ鼓膜穿孔やチューブ開存、極端に小さければプローブ先端の閉塞や耳垢による閉塞が疑われる。本症例は正常範囲なので貯留液の存在を支持する。"
          ]
        },
        {
          "id": "Q2-2",
          "prompt": "この所見から、鼓膜より奥（中耳）はどのような状態と考えられますか。",
          "space": {
            "type": "lines",
            "count": 2
          },
          "answer": [
            "中耳に液体が貯留し、鼓膜・耳小骨連鎖の可動性が低下した状態。"
          ]
        },
        {
          "id": "Q2-3",
          "prompt": "純音聴力検査の結果を予測してください。（S4 を見る前に記入すること）",
          "space": {
            "type": "fillTable",
            "widths": [
              3400,
              5620
            ],
            "header": [
              "項目",
              "予測"
            ],
            "rows": [
              [
                "気導閾値（おおよそのレベルと形）",
                ""
              ],
              [
                "骨導閾値（おおよそのレベル）",
                ""
              ],
              [
                "気骨導差（ABG）の大きさ",
                ""
              ],
              [
                "左右差",
                ""
              ],
              [
                "難聴の型（伝音／感音／混合）",
                ""
              ]
            ],
            "rowHeight": 400
          },
          "answerTable": {
            "widths": [
              3000,
              6020
            ],
            "header": [
              "項目",
              "正答"
            ],
            "rows": [
              [
                "気導",
                "15〜25 dB HL、比較的平坦またはやや低音障害"
              ],
              [
                "骨導",
                "正常範囲（0〜10 dB HL）"
              ],
              [
                "ABG",
                "15〜20 dB 程度"
              ],
              [
                "左右差",
                "ほぼなし"
              ],
              [
                "型",
                "伝音難聴"
              ]
            ]
          },
          "answer": [
            "部分点の扱い：ABG の絶対値がずれていても、「骨導正常・気導低下・両側同程度・伝音型」の4点が揃っていれば満点扱いでよい。ここで問うているのは数値の当てっこではなく、病態から気骨導関係を導けるかである。"
          ]
        },
        {
          "id": "Q2-4",
          "prompt": "アブミ骨筋反射が両側で消失していますが、これを「後迷路性病変の所見」と考えてよいですか。理由とともに答えてください。",
          "space": {
            "type": "lines",
            "count": 2,
            "height": 520
          },
          "answer": [
            "よくない。伝音難聴ではアブミ骨筋反射経路の求心路（音が蝸牛に届く段階）と遠心路（鼓膜の動きとして反射を検出する段階）の両方が障害されるため、反射は消失する。後迷路性病変を疑うのは、中耳伝達が正常であることを確認したうえで、聴力レベルに見合わない反射の消失や減衰陽性がある場合である。本症例はティンパノが B型なので、この前提を満たしていない。"
          ],
          "answerBox": {
            "fill": "warn",
            "lines": [
              "数値の注意：伝音難聴で反射が消失する ABG の目安は文献によって幅があり、単一の閾値として確定していない。本課題では「ABG が概ね 10〜15 dB を超えると消失しやすい」を教育用の設定値として扱うこと。学生に数値を暗記させる箇所ではない。"
            ]
          }
        }
      ]
    },
    {
      "id": "S3",
      "title": "DPOAE",
      "showDpoae": true,
      "questions": [
        {
          "id": "Q3-1",
          "prompt": "この DPOAE 結果を一言で表すとどうなりますか。",
          "space": {
            "type": "lines",
            "count": 1
          },
          "answer": [
            "両耳・全周波数で反応なし。"
          ]
        },
        {
          "id": "Q3-2",
          "prompt": "次の記述は正しいですか。誤りがあれば訂正してください。",
          "quote": "「DPOAE が全周波数で無反応であることから、両耳の蝸牛機能は障害されていると判断できる。したがって本症例は混合難聴である。」",
          "space": {
            "type": "lines",
            "count": 3
          },
          "answer": [
            "誤り。訂正の骨子は2点。第一に、DPOAE の無反応は中耳伝達障害によっても生じるため、これだけで蝸牛障害とは言えない。第二に、混合難聴と判断するには骨導閾値の上昇を確認する必要があるが、この時点で骨導は測定していない。したがって「混合難聴である」とは言い切れない。"
          ],
          "answerBox": {
            "fill": "info",
            "lines": [
              "この設問は S4 より前に置かれていることが重要である。骨導を知らない段階で「混合難聴と言い切れるか」を問うので、学生は「判断材料が足りない」という答えに自力でたどり着く必要がある。"
            ]
          }
        },
        {
          "id": "Q3-3",
          "prompt": "現時点で、DPOAE の結果は蝸牛機能について何を示していますか。",
          "choices": "　ア　蝸牛機能は正常である　　イ　蝸牛機能は障害されている　　ウ　この結果からは蝸牛機能を評価できない",
          "space": {
            "type": "fillTable",
            "widths": [
              1400,
              7620
            ],
            "header": [
              "選択",
              "理由"
            ],